{
  "schema_version": 1,
  "id": "giz-junior-advisor-for-the-global-gateway-investment-climate-reform-facility",
  "role": {
    "title": "Junior Advisor for the Global Gateway Investment Climate Reform Facility",
    "company": "GIZ",
    "department": null,
    "employment_type": "fixed-term",
    "seniority": "junior",
    "vacancies": 1
  },
  "location": {
    "display": "Brussels, Belgium",
    "city": "Brussels",
    "country": "Belgium",
    "work_arrangement": "hybrid",
    "remote_restrictions": null,
    "relocation_available": null
  },
  "compensation": {
    "minimum": null,
    "maximum": null,
    "currency": "EUR",
    "interval": "yearly",
    "display_original": "Remunerated according to experience (GIZ Brussels PC200)",
    "benefits_original": null
  },
  "dates": {
    "published": null,
    "deadline": null,
    "start_date": null,
    "captured": "2026-07-21T01:41:42+02:00",
    "last_verified": "2026-07-21T01:41:42+02:00"
  },
  "source": {
    "url": "https://jobs.euractiv.com/jobs/junior-advisor-m-f-d-for-the-global-gateway-investment-climate-reform-gg-icr-facility/",
    "domain": "jobs.euractiv.com",
    "reference": "Euractiv Jobs posting",
    "capture_method": "manual",
    "posting_status": "open"
  },
  "description_original": {
    "format": "plain_text",
    "content": "Junior Advisor (m/f/d) for the Global Gateway Investment Climate Reform (GG ICR) Facility\n\nOrganisation: GIZ (implemented with Expertise France and SNV; posted via Euractiv Jobs)\nLocation: Brussels, Belgium\nEngagement: Temporary contract (PC200 Belgian law)\nWork arrangement: Hybrid\nSource: https://jobs.euractiv.com/jobs/junior-advisor-m-f-d-for-the-global-gateway-investment-climate-reform-gg-icr-facility/\n\n## About the programme\n\nThe Global Gateway Investment Climate Reform (ICR) Facility supports partner governments, public institutions and private-sector representatives in improving the business environment and investment climate in line with the EU’s Global Gateway strategy. Jointly co-funded by the European Union, the German Federal Ministry for Economic Cooperation and Development (BMZ), and the French Ministry for Europe and Foreign Affairs (MEAE), the Facility is implemented by GIZ, Expertise France and SNV.\n\nThe Facility provides high-quality technical assistance, develops and disseminates knowledge products, strengthens strategic dialogue with EU institutions and contributes to evidence-based policy processes. A central component is the ICR Knowledge Hub, which consolidates lessons learned, maintains methodological standards, and ensures cross-regional learning aligned with Global Gateway priorities.\n\n## Tasks\n\nReinforcing the Brussels-based team, the Junior Advisor for the GG ICR Facility works closely with all team members, most particularly with GIZ staff but also with partner organisations across INTPA partner countries to:\n\n- Support the implementation of the outreach strategies for the GG ICR Facility\n- Support the management of technical assistance interventions in support of GG ICR partner organisations (governments, public agencies, chambers, associations etc), with a focus on business environment reform, including for each intervention:\n  - Assessing the request for support from partner organisations, through interviews with requesters and other relevant actors\n  - Draft Terms of Reference for the proposed intervention\n  - Select and manage consultants to implement the intervention\n  - Organise and hold regular exchanges with the requesters and consultants to ensure sound implementation\n  - Liaise with the EU Delegations and other donors in the respective countries\n  - Ensure collection of required data for monitoring and evaluating impact\n  - Ensure adherence to communication and visibility rules by all actors, in particular consultants\n- Contribute to GG ICR Facility knowledge management through studies, training, peer-events, especially in business environment reforms and women's economic empowerment\n- Support Monitoring and Evaluation (M&E) efforts, including baseline/endline data and donor reporting (EU and BMZ)\n\n## Requirements\n\n- Master’s degree or equivalent in economics, political science, public policy, international development, business administration, law, or another relevant field\n- First relevant professional experience in international development cooperation, preferably private sector development, investment climate reform, business environment reform, public-private dialogue, women’s economic empowerment, trade, or economic governance\n- First professional experience working with stakeholders of developing countries; first experience managing technical assistance interventions\n- Strong conceptual and analytical skills\n- Understanding of EU development cooperation, Global Gateway, EU Delegations, and Team Europe\n- Excellent English; French and/or Spanish strong assets; Portuguese an advantage\n- High intercultural competence, political sensitivity, flexibility\n- Willingness to travel to INTPA partner countries and within Europe\n\n## Offer\n\nTemporary contract with GIZ in Brussels under Belgian law (PC200). Remunerated according to experience. Legal holidays plus 5 extra days, lunch checks, hospitalisation insurance, public transport ticket reimbursement, home office per policy.\n\nOnly applications for candidates eligible to work in Belgium will be accepted. Apply via the Euractiv Jobs posting Apply button.\n",
    "language": "en",
    "captured_at": "2026-07-21T01:41:42+02:00",
    "sha256": "8c832ba33cc6da62a11b7f7ec9b077f99070ecf719df422f1acdcd7ae3759d8a"
  },
  "classification": {
    "tags": [
      "economics",
      "development",
      "global-gateway",
      "investment-climate"
    ],
    "priority": "medium"
  }
}
