{
  "schema_version": 1,
  "id": "example-company-policy-officer",
  "role": {
    "title": "Policy Officer",
    "company": "Example Company",
    "department": "European Affairs",
    "employment_type": "full-time",
    "seniority": null,
    "vacancies": 1
  },
  "location": {
    "display": "Brussels, Belgium",
    "city": "Brussels",
    "country": "Belgium",
    "work_arrangement": "hybrid",
    "remote_restrictions": null,
    "relocation_available": null
  },
  "compensation": {
    "minimum": null,
    "maximum": null,
    "currency": "EUR",
    "interval": "yearly",
    "display_original": null,
    "benefits_original": null
  },
  "dates": {
    "published": null,
    "deadline": "2026-08-15",
    "start_date": null,
    "captured": "2026-07-20T14:30:00+02:00",
    "last_verified": "2026-07-20T14:30:00+02:00"
  },
  "source": {
    "url": "https://example.com/jobs/policy-officer",
    "domain": "example.com",
    "reference": null,
    "capture_method": "manual",
    "posting_status": "open"
  },
  "description_original": {
    "format": "plain_text",
    "content": "The complete job description is pasted here exactly as published.",
    "language": "en",
    "captured_at": "2026-07-20T14:30:00+02:00",
    "sha256": "d64e54f894b3d017c37d80456a6bcd4fb1a5536a7a5cf51447718ae227347bd8"
  },
  "classification": {
    "tags": ["policy", "eu-affairs"],
    "priority": "medium"
  }
}
