{
  "schema_version": 1,
  "id": "icmpd-team-assistant",
  "role": {
    "title": "Team Assistant",
    "company": "ICMPD",
    "department": null,
    "employment_type": "fixed-term",
    "seniority": "assistant",
    "vacancies": 1
  },
  "location": {
    "display": "Brussels, Belgium",
    "city": "Brussels",
    "country": "Belgium",
    "work_arrangement": "on-site",
    "remote_restrictions": null,
    "relocation_available": null
  },
  "compensation": {
    "minimum": 2662,
    "maximum": 2662,
    "currency": "EUR",
    "interval": "monthly",
    "display_original": "Monthly net-base salary: €2,662.00",
    "benefits_original": null
  },
  "dates": {
    "published": null,
    "deadline": "2026-07-27",
    "start_date": null,
    "captured": "2026-07-21T01:41:42+02:00",
    "last_verified": "2026-07-10T00:00:00+02:00"
  },
  "source": {
    "url": "https://careers.icmpd.org/Home/JobOpeningDetails?jobOpeningId=1187",
    "domain": "careers.icmpd.org",
    "reference": "Generic Job Description Team Assistant (S1 LS1).pdf",
    "capture_method": "manual",
    "posting_status": "open"
  },
  "description_original": {
    "format": "plain_text",
    "content": "Team Assistant\n\nOrganisation: ICMPD\nLocation: Brussels, Belgium\nEngagement: Fixed-term\nCompensation: Monthly net-base salary: €2,662.00\nDeadline: 27 July 2026\nWork arrangement: On-site\nSource: https://careers.icmpd.org/Home/JobOpeningDetails?jobOpeningId=1187\nSource documents: Generic Job Description Team Assistant (S1 LS1).pdf\n\n## Overview\n\nThis is a joint recruitment covering two Team Assistant positions across two ICMPD Global Initiatives: the European Union Migration and Displacement Capacity Assistance Project (EU-MIDCAP) and the Return and Reintegration Facility (RRF). Each Team Assistant will be assigned to one of the two initiatives.\n\n## Role\n\nThe Team Assistant is responsible for providing smooth, efficient, and reliable administrative support to managers and project staff for project-related activities. Reporting to the respective Project Manager, they work closely with project team members and provide guidance to new staff and personnel on ICMPD’s regulatory framework, standard administrative practices, and operating procedures.\n\n## Language requirements\n\n- Required: Proficiency in spoken and written English\n- Assets: Proficiency in French and Spanish\n\n## Project assignments\n\n### EU-MIDCAP\n\nThe European Union Migration and Displacement Capacity Assistance Project (EU-MIDCAP) is an EU-funded, DG INTPA-supported, consortium-led peer-to-peer facility. It supports partner-country authorities, civil society organisations, and regional bodies in strengthening migration and forced-displacement management systems and cooperation with the EU and its Member States.\n\nThe Team Assistant will provide cross-cutting support to the project and several Technical Assistance Actions, including in French- and Spanish-speaking countries, and will report to one of the Project Managers.\n\n### Return and Reintegration Facility (RRF)\n\nThe Return and Reintegration Facility (RRF) is an EU-funded programme supported by DG HOME. Established in 2022, it helps EU Member States strengthen the effectiveness, coordination, and sustainability of their return and reintegration systems. More information is available at https://www.reintegrationfacility.eu/.\n\nThe Team Assistant will join the RRF Facility Support and Knowledge Team, providing horizontal administrative support across the RRF’s four sub-teams, comprising around 25 team members in total, and will report to one of the Project Managers.\n\n## Generic profile (S1/LS1) summary\n\nThe Team Assistant provides administrative support including correspondence, reports, databases, expert recruitment/procurement support, travel organisation, contract monitoring, and events/meetings logistics. Requires bachelor's degree or equivalent (or high-school plus two additional years), at least two years relevant experience, events experience, strong English; SAP an asset. Classified S1/LS1.\n",
    "language": "en",
    "captured_at": "2026-07-21T01:41:42+02:00",
    "sha256": "16c990ce87bad5f069b1d9e3dd63235ea3792592f1a0cf1942b3e1c908fee283"
  },
  "classification": {
    "tags": [
      "administration",
      "migration",
      "assistant"
    ],
    "priority": "high"
  }
}
