{
  "schema_version": 1,
  "id": "green-european-foundation-policy-consultant-on-green-transition",
  "role": {
    "title": "Policy Consultant on Green Transition",
    "company": "Green European Foundation",
    "department": null,
    "employment_type": "consultancy",
    "seniority": "consultant",
    "vacancies": 1
  },
  "location": {
    "display": "Brussels, Belgium",
    "city": "Brussels",
    "country": "Belgium",
    "work_arrangement": "hybrid",
    "remote_restrictions": null,
    "relocation_available": null
  },
  "compensation": {
    "minimum": null,
    "maximum": 35000,
    "currency": "EUR",
    "interval": "yearly",
    "display_original": "Maximum estimated value €35,000/year excluding VAT; daily fee requested",
    "benefits_original": null
  },
  "dates": {
    "published": null,
    "deadline": "2026-07-14",
    "start_date": "2026-08-01",
    "captured": "2026-07-21T00:28:01+02:00",
    "last_verified": "2026-07-10T00:00:00+02:00"
  },
  "source": {
    "url": "https://gef.eu/",
    "domain": "gef.eu",
    "reference": "Call-for-policy-consultant-on-green-transition.pdf",
    "capture_method": "manual",
    "posting_status": "closed"
  },
  "description_original": {
    "format": "plain_text",
    "content": "# Policy Consultant on Green Transition\n\nApplication stage: Saved\nCompensation: Maximum estimated value €35,000/year excluding VAT; daily fee requested\nDeadline: July 14, 2026 9:00 AM (GMT+2)\nEngagement: Consultancy\nLast reviewed: July 10, 2026\nLevel: Consultant\nLocation: Brussels, Belgium\nOrganisation: Green European Foundation (GEF)\nSource documents: Call-for-policy-consultant-on-green-transition.pdf\nStart date: August 1, 2026\nThemes: Climate, Energy, Policy\nWork arrangement: Hybrid\n\n## Purpose\n\nGEF seeks a research and policy adviser focused on EU energy policy, eco-social policy, rights-based approaches, and wellbeing. The provider will produce research, analysis, recommendations, publications, events, and stakeholder engagement while supporting GEF as a hub for green policy expertise.\n\n## Tasks and deliverables\n\n- Conduct qualitative and quantitative policy research on the green transition.\n- Liaise with NGOs, think tanks, policymakers, and institutional actors.\n- Coordinate a Knowledge Community on participation in the EU energy transition.\n- Moderate, take notes, and report on expert roundtables.\n- Coordinate external experts and draft or review political briefs.\n- Support additional work on EU social policy, the economy, sustainable welfare, and wellbeing.\n- Support events, meetings, conferences, representation, and network building.\n- Deliver content and financial reporting.\n\n## Contract\n\n- Service-provider arrangement averaging 1.5 days per week in the Brussels office, with telework possible.\n- Initial mission from August 2026 to August 2027.\n- Renewable up to five years based on quality and performance.\n- Maximum estimated annual value: €35,000 excluding VAT.\n- Proposal should state a daily fee, VAT rate, and any minimum billable amount.\n\n## Selection criteria\n\n- High-quality qualitative and quantitative policy research.\n- Strong expertise and networks in EU energy policy, eco-social policy, rights-based approaches, and wellbeing.\n- Science and technology policy background and experience connecting advocacy, policy, and technical analysis.\n- Knowledge of EU institutions, policymaking, political dynamics, and diverse green-transition contexts.\n- Research design, coordination, and leadership.\n- Excellent English policy writing, presentation, public speaking, and facilitation.\n- At least five years of relevant policy research or advisory experience.\n- Strong stakeholder engagement, organisation, and time management.\n- Availability for in-person work in Brussels.\n\n## Award methodology\n\nBest price-quality ratio:\n\n- EU energy and related policy expertise: 30%.\n- Project coordination and research leadership: 20%.\n- Communication, writing, and dissemination: 20%.\n- Financial offer: 30%.\n\nFormula: [(lowest price / tenderer's price) × 30] + [(quality score / 100) × 70].\n\n## Application package\n\n- Introduction covering background, interest, competence, and fit.\n- Competitive daily fee in euros excluding VAT, with VAT rate.\n- CV and relevant writing, research, and policy samples.\n- Exclusion-criteria and conflict-of-interest declaration, or ESPD.\n- Submit through the official application form.\n\nQuestions: jamie.kendrick@gef.eu\n\nContracting party: Green European Foundation, Avenue des Arts 7-8, 1210 Brussels.\n\n## Source\n\nCall-for-policy-consultant-on-green-transition.pdf",
    "language": "en",
    "captured_at": "2026-07-21T00:28:01+02:00",
    "sha256": "7351b8a041608763c454f151fcd2176ac3497199449c72aa4c3f315d1db3c6c0"
  },
  "classification": {
    "tags": [
      "climate",
      "energy",
      "policy",
      "consultancy"
    ],
    "priority": "medium"
  }
}
