{
  "schema_version": 1,
  "id": "beuc-food-policy-trainee-6-months-traineeship",
  "role": {
    "title": "Food policy Trainee (6 months traineeship)",
    "company": "BEUC",
    "department": null,
    "employment_type": "internship",
    "seniority": "internship",
    "vacancies": 1
  },
  "location": {
    "display": "Brussels, Belgium",
    "city": "Brussels",
    "country": "Belgium",
    "work_arrangement": "hybrid",
    "remote_restrictions": null,
    "relocation_available": null
  },
  "compensation": {
    "minimum": 1325,
    "maximum": 1325,
    "currency": "EUR",
    "interval": "monthly",
    "display_original": "€1,325/month (CIP scheme)",
    "benefits_original": null
  },
  "dates": {
    "published": null,
    "deadline": "2026-06-26",
    "start_date": "2026-07-13",
    "captured": "2026-07-21T01:41:42+02:00",
    "last_verified": "2026-07-10T00:00:00+02:00"
  },
  "source": {
    "url": "https://www.beuc.eu/vacancy/food-policy-trainee",
    "domain": "www.beuc.eu",
    "reference": null,
    "capture_method": "manual",
    "posting_status": "closed"
  },
  "description_original": {
    "format": "plain_text",
    "content": "Food policy Trainee (6 months traineeship)\n\nOrganisation: BEUC – The European Consumer Organisation\nLocation: Brussels, Belgium\nEngagement: Internship (CIP)\nCompensation: €1,325/month (CIP scheme)\nDeadline: 26 June 2026\nWork arrangement: Hybrid\nSource: https://www.beuc.eu/vacancy/food-policy-trainee\n\n## About the role\n\nBEUC – The European Consumer Organisation is looking for a Food policy trainee to support the implementation of BEUC’s strategy on food under the supervision of the team One health – dealing with food, health, and chemicals safety.\n\n## Responsibilities\n\n- Supporting the development of a toolkit for consumer organisations with advocacy materials to advance policy action at national level on plant-based foods.\n- Monitoring and analysing EU developments related to food policy.\n- Mapping relevant stakeholders and supporting engagement with EU institutions and civil society.\n- Gathering and analysing evidence from BEUC members, academic sources, and other relevant materials.\n- Supporting the preparation of meetings and events, including drafting agendas, background notes, and follow-up actions.\n- Taking minutes of internal and external meetings.\n\n## Candidate profile\n\n- University degree in public health, law, political science or a related field.\n- A strong interest in EU food policy and on initiatives that can help promote plant-based foods and diets.\n- Good understanding of EU institutions and decision-making processes.\n- Strong analytical skills and the ability to synthesise complex information.\n- Very good drafting skills in English.\n- Good organisational skills and attention to detail.\n- Proactive attitude and willingness to learn.\n- Previous experience or academic work related to food policy or consumer protection is an asset.\n\n## What BEUC offers\n\n- A 6-month paid traineeship under a Convention d’Immersion Professionnelle (CIP) with a competitive package including:\n  - An allocation of 1,325€ per month.\n  - Fringe benefits: Homeworking allowance, public transport, 12 days extra-legal paid leave.\n  - Flexitime, homeworking possibility (up to 3 days per week), work-life balance.\n- A welcoming onboarding.\n- A workplace committed to support staff growth and well-being.\n- A multidisciplinary and multicultural working environment within an organisation dedicated to promoting consumer interests.\n\n## Location and working arrangements\n\nAs the contract is subject to Belgian law, candidates must be committed to official registration in Belgium and working from BEUC’s Brussels office. Teleworking from home or abroad is possible, subject to the remote-working policy and organisational needs.\n\n## Application process\n\nApplications should be sent by 26 June 2026 by e-mail to apply@beuc.eu with the subject line: Food policy Trainee.\n\nInclude:\n1. A curriculum vitae, with no photo\n2. A motivation letter, maximum one page\n\nEntry into function expected as of 13 July 2026. Interviews as of 1 July 2026 with Head of Human Resources and Head of One Health.\n\nBEUC is an equal opportunities employer.\n",
    "language": "en",
    "captured_at": "2026-07-21T01:41:42+02:00",
    "sha256": "f0eff090c374accd91e750505da1d5858ac7ae22948b7cfe34676131744285cc"
  },
  "classification": {
    "tags": [
      "policy",
      "food",
      "internship",
      "consumer"
    ],
    "priority": "low"
  }
}
