{
  "schema_version": 1,
  "id": "plan-international-climate-economic-empowerment-lead",
  "role": {
    "title": "Climate & Economic Empowerment Lead",
    "company": "Plan International",
    "department": null,
    "employment_type": "full-time",
    "seniority": "lead",
    "vacancies": 1
  },
  "location": {
    "display": "Globally flexible; Asia-Pacific preferred; Belgium eligible",
    "city": null,
    "country": "Belgium",
    "work_arrangement": "remote",
    "remote_restrictions": null,
    "relocation_available": null
  },
  "compensation": {
    "minimum": null,
    "maximum": null,
    "currency": "EUR",
    "interval": "yearly",
    "display_original": null,
    "benefits_original": null
  },
  "dates": {
    "published": null,
    "deadline": "2026-07-12",
    "start_date": null,
    "captured": "2026-07-21T01:41:42+02:00",
    "last_verified": "2026-07-10T00:00:00+02:00"
  },
  "source": {
    "url": "https://jobs.plan-international.org/",
    "domain": "jobs.plan-international.org",
    "reference": "Climate & Economic Empowerment Lead Job Details | Plan International.pdf; Career Opportunities: Apply for Climate & Economic Empowerment Lead (54094).pdf",
    "capture_method": "manual",
    "posting_status": "closed"
  },
  "description_original": {
    "format": "plain_text",
    "content": "Climate & Economic Empowerment Lead\n\nOrganisation: Plan International\nLocation: Globally flexible; Asia-Pacific preferred; Belgium eligible\nEngagement: Permanent (or maximum fixed-term under employing office terms)\nDeadline: 12 July 2026\nWork arrangement: Remote/Flexible\nSources: Climate & Economic Empowerment Lead Job Details | Plan International.pdf; Career Opportunities: Apply for Climate & Economic Empowerment Lead (54094).pdf\n\n## Role purpose\n\nLead Plan International's global Climate & Economic Empowerment agenda, advancing climate justice and resilient livelihoods for girls, young people, and marginalised communities. The role connects climate change, gender equality, youth economic empowerment, evidence, advocacy, programming, and resource mobilisation.\n\n## Responsibilities\n\n- Set the global vision, ambition, standards, and value proposition.\n- Build a strategic narrative grounded in climate resilience, community livelihoods, youth economic empowerment, and intersectional gender-transformative approaches.\n- Strengthen donor positioning, partnerships, resource mobilisation, and climate-finance opportunities.\n- Provide technical and thought leadership in climate and livelihoods.\n- Represent Plan International externally and influence sector dialogue.\n- Connect climate resilience with livelihoods, education, protection, and youth opportunity.\n- Translate research and field learning into advocacy, programme design, strategy, and funding narratives.\n- Align global, regional, and country teams and promote learning and innovation.\n\n## Candidate profile\n\n- Strong climate, resilience, and economic empowerment expertise.\n- Experience in resource-constrained, fragile, or climate-affected contexts.\n- Strong understanding of gender-transformative and youth-led approaches.\n- Experience with climate funding mechanisms, partnerships, or global donors.\n- Evidence-to-strategy, advocacy, and funding experience.\n- External representation, influencing, and partnership development.\n- Leadership through influence in a complex global matrix.\n- Excellent communication, facilitation, and strategic thinking.\n\n## Contract and eligibility\n\nPermanent full-time or maximum fixed-term contract under the employing office's terms. The applicant must already have the right to live and work in an eligible country where Plan International can employ for the Global Hub. The preferred location is an Asia-Pacific office; Belgium is among the eligible locations.\n\n## Role-specific application questions\n\n1. Describe experience engaging multilateral or global climate funding mechanisms such as the Green Climate Fund or Adaptation Fund (max 400 characters). Explain your role in securing or influencing access and how programming remained gender-transformative and community-driven.\n2. Give an example of translating complex climate and livelihoods evidence into a strategic narrative (max 400 characters). Identify the evidence, audience—from community practitioners to global donors—and outcome.\n\n## Safeguarding and inclusion\n\nPlan International operates equal-opportunity, safeguarding, pre-employment screening, and Inter-Agency Misconduct Disclosure processes. Reasonable adjustments: careers@plan-international.org.\n",
    "language": "en",
    "captured_at": "2026-07-21T01:41:42+02:00",
    "sha256": "39cba17b68ca4ac47522e6ead334e66af8925478c64d4384c5876e78d6f987ee"
  },
  "classification": {
    "tags": [
      "climate",
      "economic-empowerment",
      "policy",
      "gender"
    ],
    "priority": "low"
  }
}
